{
  "version": "1.0.0",
  "description": "ECDAT Context-Aware Post-Quantum Cryptography and Classical Remediation Recommendations",
  "last_updated": "2026-09-04",
  "recommendations": [
    {
      "recommendation_id": "rec_kem_hybrid_tls",
      "target_category": "tls_protocol",
      "applies_to_algorithms": ["RSA", "ECDH", "Diffie-Hellman", "X25519", "TLS 1.2", "TLS 1.3"],
      "current_condition": "TLS session utilizing classical key agreement (ECDHE/DHE) or static RSA key exchange.",
      "proposed_option": "Enable TLS 1.3 with X25519MLKEM768 (or SecP256r1MLKEM768) hybrid key exchange group.",
      "standard_reference": "NIST FIPS 203 (ML-KEM) & IETF draft-ietf-tls-hybrid-design",
      "security_rationale": "X25519MLKEM768 provides 128-bit classical security via Curve25519 ECDHE and NIST Security Category 3 quantum security via ML-KEM-768 lattice-based key encapsulation. The combiner function ensures IND-CCA2 security holds if either underlying assumption (Discrete Logarithm or Module-LWE) remains hard, actively neutralizing HNDL threats.",
      "compatibility_risk": "low",
      "estimated_migration_complexity": "low",
      "latency_impact_category": "minor",
      "bandwidth_storage_impact_category": "minor",
      "cost_category": "low",
      "hybrid_transition_recommended": true,
      "confidence_and_assumptions": "Assumes modern TLS stack (OpenSSL 3.2+, BoringSSL, Go 1.23+, or Cloudflare/AWS edge proxies) that supports hybrid post-quantum key shares in the TLS ClientHello."
    },
    {
      "recommendation_id": "rec_kem_general_key_exchange",
      "target_category": "key_establishment",
      "applies_to_algorithms": ["RSA", "ECDH", "Diffie-Hellman"],
      "current_condition": "Custom or protocol-level key encapsulation/establishment using classical RSA-OAEP or ECDH.",
      "proposed_option": "Migrate to ML-KEM-768 (NIST Security Category 3) or ML-KEM-1024 (Category 5) in a dual-KEM hybrid envelope.",
      "standard_reference": "NIST FIPS 203 & RFC 9180 (HPKE with PQC extension)",
      "security_rationale": "Shor's algorithm solves both the discrete logarithm (DLP) and integer factorization (IFP) problems in polynomial time O((log N)^3) on a CRQC, completely breaking RSA/ECC. ML-KEM provides semantic security under chosen ciphertext attack (IND-CCA2) based on the computational hardness of the Module Learning with Errors (M-LWE) problem.",
      "compatibility_risk": "medium",
      "estimated_migration_complexity": "medium",
      "latency_impact_category": "minor",
      "bandwidth_storage_impact_category": "moderate",
      "cost_category": "medium",
      "hybrid_transition_recommended": true,
      "confidence_and_assumptions": "ML-KEM public keys (~1184 bytes) and ciphertexts (~1088 bytes) are larger than classical EC keys (~32-64 bytes). Ensure buffers and database fields accommodate expanded payloads."
    },
    {
      "recommendation_id": "rec_sig_general_pqc",
      "target_category": "digital_signature",
      "applies_to_algorithms": ["RSA", "DSA", "ECDSA"],
      "current_condition": "Digital signature verification and generation using classical RSA, DSA, or ECDSA.",
      "proposed_option": "Migrate to ML-DSA-65 (FIPS 204) for general signatures, or SLH-DSA (FIPS 205) where stateless hash assumptions are preferred.",
      "standard_reference": "NIST FIPS 204 (ML-DSA) & NIST FIPS 205 (SLH-DSA)",
      "security_rationale": "A CRQC executing Shor's algorithm can recover classical RSA/ECC private keys from public keys in polynomial time, enabling trivial signature forgery. ML-DSA (FIPS 204) provides EUF-CMA security derived from the hardness of the Module Short Integer Solution (M-SIS) and M-LWE problems.",
      "compatibility_risk": "medium",
      "estimated_migration_complexity": "high",
      "latency_impact_category": "moderate",
      "bandwidth_storage_impact_category": "significant",
      "cost_category": "medium",
      "hybrid_transition_recommended": true,
      "confidence_and_assumptions": "Signature size increases from ~64 bytes (ECDSA) to ~3.3 KB (ML-DSA-65) or ~17 KB (SLH-DSA). X.509 PKI certificates and verification caches must support larger certificate chains."
    },
    {
      "recommendation_id": "rec_sig_stateful_firmware",
      "target_category": "digital_signature",
      "applies_to_algorithms": ["RSA", "ECDSA"],
      "current_condition": "Firmware verification, bootloader integrity, or constrained device code signing with strictly bounded signature counts.",
      "proposed_option": "Implement stateful hash-based signatures (LMS/HSS via RFC 8554 or XMSS via RFC 8391).",
      "standard_reference": "NIST SP 800-208 & CNSA 2.0 Timeline for Software/Firmware Signing",
      "security_rationale": "LMS/HSS and XMSS rely purely on the pre-image and collision resistance of the underlying cryptographic hash function (e.g., SHA-256). They do not depend on number-theoretic assumptions, offering conservative post-quantum security under the condition that state (Merkle tree leaf index) is monotonically incremented on NVRAM.",
      "compatibility_risk": "medium",
      "estimated_migration_complexity": "high",
      "latency_impact_category": "minor",
      "bandwidth_storage_impact_category": "moderate",
      "cost_category": "medium",
      "hybrid_transition_recommended": false,
      "confidence_and_assumptions": "Requires state management across signing operations to prevent one-time key reuse catastrophic security failures. Verification is stateless and extremely fast."
    },
    {
      "recommendation_id": "rec_ssh_hybrid_kex",
      "target_category": "ssh_protocol",
      "applies_to_algorithms": ["Diffie-Hellman", "ECDH", "RSA"],
      "current_condition": "SSH server or client utilizing classical diffie-hellman-group-exchange or ecdh-sha2-nistp256.",
      "proposed_option": "Configure SSH to negotiate sntrup761x25519-sha512@openssh.com or mlkem768x25519-sha512@openssh.com.",
      "standard_reference": "OpenSSH 9.0+ PQC Implementation & IETF draft-kampanakis-curdle-ssh-pq-kex",
      "security_rationale": "Standard SSH KEX (e.g., diffie-hellman-group14-sha256) is susceptible to retrospective decryption. `sntrup761x25519-sha512` provides a composite KEM leveraging the hardness of the NTRU lattice problem alongside classical Curve25519 ECDH to secure the session key material.",
      "compatibility_risk": "low",
      "estimated_migration_complexity": "low",
      "latency_impact_category": "minor",
      "bandwidth_storage_impact_category": "minor",
      "cost_category": "low",
      "hybrid_transition_recommended": true,
      "confidence_and_assumptions": "Supported by default in OpenSSH 9.0 and later. Ensure legacy embedded or bastion devices support the hybrid key exchange algorithms."
    },
    {
      "recommendation_id": "rec_stored_data_envelope",
      "target_category": "stored_data_encryption",
      "applies_to_algorithms": ["RSA", "ECDH", "AES-128"],
      "current_condition": "Long-lived encrypted data (shelf-life > 10 years, e.g. financial ledgers, medical records, backups) protected by classical RSA/ECDH key wraps.",
      "proposed_option": "Wrap symmetric data encryption keys (DEKs) using a hybrid KEM (ML-KEM-768 + X25519) and re-encrypt DEKs under AES-256-GCM.",
      "standard_reference": "CNSA 2.0 Stored Data Guidance & NIST FIPS 203",
      "security_rationale": "To neutralize HNDL on ciphertext with a shelf-life X > Z (quantum threat horizon), Data Encryption Keys (DEKs) wrapped via classical RSA-OAEP must be re-wrapped using a dual-KEM envelope (e.g., RSA-3072 + ML-KEM-768). The underlying block cipher must also utilize a 256-bit key space to maintain a 128-bit quantum security margin against Grover's algorithm.",
      "compatibility_risk": "high",
      "estimated_migration_complexity": "very_high",
      "latency_impact_category": "minor",
      "bandwidth_storage_impact_category": "minor",
      "cost_category": "high",
      "hybrid_transition_recommended": true,
      "confidence_and_assumptions": "Requires envelope re-wrapping and key management system (KMS) support for PQC key types. Existing symmetric ciphertext does not need full bulk re-encryption if the DEK is sufficiently long (AES-256)."
    },
    {
      "recommendation_id": "rec_symmetric_quantum_margin",
      "target_category": "symmetric_cipher_quantum_margin",
      "applies_to_algorithms": ["AES", "AES-128"],
      "current_condition": "Symmetric encryption using AES-128 for high-value or long-retention data.",
      "proposed_option": "Upgrade to AES-256 in Galois/Counter Mode (AES-256-GCM) or ChaCha20-Poly1305.",
      "standard_reference": "NIST SP 800-57 Part 1 Rev 5 & CNSA 2.0 Symmetric Cipher Mandate",
      "security_rationale": "Grover's amplitude amplification algorithm accelerates unstructured exhaustive key search to O(sqrt(N)), reducing the effective quantum security margin of AES-128 to ~64 bits. AES-256 is mandated to ensure a post-quantum minimum of 128 bits of symmetric entropy.",
      "compatibility_risk": "low",
      "estimated_migration_complexity": "low",
      "latency_impact_category": "negligible",
      "bandwidth_storage_impact_category": "negligible",
      "cost_category": "low",
      "hybrid_transition_recommended": false,
      "confidence_and_assumptions": "Hardware AES-NI acceleration in x86/ARM processors handles AES-256 with negligible performance penalty (typically < 10% CPU overhead over AES-128)."
    },
    {
      "recommendation_id": "rec_classical_hash_broken",
      "target_category": "classical_hash_migration",
      "applies_to_algorithms": ["MD5", "SHA-1"],
      "current_condition": "Usage of deprecated cryptographic hash functions MD5 or SHA-1.",
      "proposed_option": "Replace with SHA-256, SHA-384, or SHA-3 (FIPS 202). For password storage, migrate to Argon2id (RFC 9106).",
      "standard_reference": "NIST SP 800-131A Rev 2 & RFC 9106",